{
  "schemaVersion": 1,
  "meta": {
    "createdAt": "2025-12-30T23:58:06.635Z",
    "from": {
      "file": "specs/056-core-ng-schema-layout-accessors/perf/before.node.core-ng.execVm.on.converge.txnCommit.darwin-arm64.20251231-075130.default.json",
      "commit": "6312fd64cd3c1819ce8ab1c995c47927e9390dcf"
    },
    "to": {
      "file": "specs/056-core-ng-schema-layout-accessors/perf/after.node.core-ng.execVm.on.converge.txnCommit.darwin-arm64.20251231-075738.default.json",
      "commit": "6312fd64cd3c1819ce8ab1c995c47927e9390dcf"
    },
    "comparability": {
      "comparable": true,
      "allowConfigDrift": false,
      "allowEnvDrift": false,
      "configMismatches": [],
      "envMismatches": [],
      "warnings": [
        "git.dirty.before=true",
        "git.dirty.after=true"
      ]
    }
  },
  "summary": {
    "regressions": 0,
    "improvements": 1,
    "budgetViolations": 0
  },
  "suites": [
    {
      "id": "converge.txnCommit",
      "thresholdDeltas": [
        {
          "budget": {
            "id": "auto<=full*1.05",
            "type": "relative",
            "metric": "runtime.txnCommitMs",
            "maxRatio": 1.05,
            "numeratorRef": "convergeMode=auto",
            "denominatorRef": "convergeMode=full"
          },
          "where": {
            "dirtyRootsRatio": 0.25
          },
          "beforeMaxLevel": null,
          "afterMaxLevel": 2000,
          "message": "[category=runtime] auto<=full*1.05 {dirtyRootsRatio=0.25}: before=null after=2000 (before:budgetExceeded)"
        }
      ],
      "budgetViolations": [],
      "evidenceDeltas": [
        {
          "name": "diagnostics.overhead.fullOverOff.txnCommitMs.medianDeltaMs",
          "unit": "count",
          "scope": "points",
          "before": {
            "ok": 36,
            "unavailable": 0,
            "missing": 0,
            "value": 63.55417499999987
          },
          "after": {
            "ok": 36,
            "unavailable": 0,
            "missing": 0,
            "value": 61.95146200000045
          },
          "message": "diagnostics.overhead.fullOverOff.txnCommitMs.medianDeltaMs(points) unit=count: before[value=63.55417499999987 ok=36 unavailable=0 missing=0] after[value=61.95146200000045 ok=36 unavailable=0 missing=0]"
        },
        {
          "name": "diagnostics.overhead.fullOverOff.txnCommitMs.medianDeltaRatio",
          "unit": "ratio",
          "scope": "points",
          "before": {
            "ok": 36,
            "unavailable": 0,
            "missing": 0,
            "value": 1.045013444300261
          },
          "after": {
            "ok": 36,
            "unavailable": 0,
            "missing": 0,
            "value": 1.1707547634537905
          },
          "message": "diagnostics.overhead.fullOverOff.txnCommitMs.medianDeltaRatio(points) unit=ratio: before[value=1.045013444300261 ok=36 unavailable=0 missing=0] after[value=1.1707547634537905 ok=36 unavailable=0 missing=0]"
        },
        {
          "name": "diagnostics.overhead.fullOverOff.txnCommitMs.medianRatio",
          "unit": "ratio",
          "scope": "points",
          "before": {
            "ok": 36,
            "unavailable": 0,
            "missing": 0,
            "value": 2.045013444300261
          },
          "after": {
            "ok": 36,
            "unavailable": 0,
            "missing": 0,
            "value": 2.1707547634537905
          },
          "message": "diagnostics.overhead.fullOverOff.txnCommitMs.medianRatio(points) unit=ratio: before[value=2.045013444300261 ok=36 unavailable=0 missing=0] after[value=2.1707547634537905 ok=36 unavailable=0 missing=0]"
        },
        {
          "name": "diagnostics.overhead.fullOverOff.txnCommitMs.p95DeltaMs",
          "unit": "count",
          "scope": "points",
          "before": {
            "ok": 36,
            "unavailable": 0,
            "missing": 0,
            "value": 66.70879499999955
          },
          "after": {
            "ok": 36,
            "unavailable": 0,
            "missing": 0,
            "value": 67.61124800000346
          },
          "message": "diagnostics.overhead.fullOverOff.txnCommitMs.p95DeltaMs(points) unit=count: before[value=66.70879499999955 ok=36 unavailable=0 missing=0] after[value=67.61124800000346 ok=36 unavailable=0 missing=0]"
        },
        {
          "name": "diagnostics.overhead.fullOverOff.txnCommitMs.p95DeltaRatio",
          "unit": "ratio",
          "scope": "points",
          "before": {
            "ok": 36,
            "unavailable": 0,
            "missing": 0,
            "value": 1.058429501744179
          },
          "after": {
            "ok": 36,
            "unavailable": 0,
            "missing": 0,
            "value": 1.1773565656567944
          },
          "message": "diagnostics.overhead.fullOverOff.txnCommitMs.p95DeltaRatio(points) unit=ratio: before[value=1.058429501744179 ok=36 unavailable=0 missing=0] after[value=1.1773565656567944 ok=36 unavailable=0 missing=0]"
        },
        {
          "name": "diagnostics.overhead.fullOverOff.txnCommitMs.p95Ratio",
          "unit": "ratio",
          "scope": "points",
          "before": {
            "ok": 36,
            "unavailable": 0,
            "missing": 0,
            "value": 2.058429501744179
          },
          "after": {
            "ok": 36,
            "unavailable": 0,
            "missing": 0,
            "value": 2.1773565656567944
          },
          "message": "diagnostics.overhead.fullOverOff.txnCommitMs.p95Ratio(points) unit=ratio: before[value=2.058429501744179 ok=36 unavailable=0 missing=0] after[value=2.1773565656567944 ok=36 unavailable=0 missing=0]"
        },
        {
          "name": "diagnostics.overhead.lightOverOff.txnCommitMs.medianDeltaRatio",
          "unit": "ratio",
          "scope": "points",
          "before": {
            "ok": 36,
            "unavailable": 0,
            "missing": 0,
            "value": 1.1853620901421924
          },
          "after": {
            "ok": 36,
            "unavailable": 0,
            "missing": 0,
            "value": 1.1919371249995452
          },
          "message": "diagnostics.overhead.lightOverOff.txnCommitMs.medianDeltaRatio(points) unit=ratio: before[value=1.1853620901421924 ok=36 unavailable=0 missing=0] after[value=1.1919371249995452 ok=36 unavailable=0 missing=0]"
        },
        {
          "name": "diagnostics.overhead.lightOverOff.txnCommitMs.medianRatio",
          "unit": "ratio",
          "scope": "points",
          "before": {
            "ok": 36,
            "unavailable": 0,
            "missing": 0,
            "value": 2.1853620901421924
          },
          "after": {
            "ok": 36,
            "unavailable": 0,
            "missing": 0,
            "value": 2.191937124999545
          },
          "message": "diagnostics.overhead.lightOverOff.txnCommitMs.medianRatio(points) unit=ratio: before[value=2.1853620901421924 ok=36 unavailable=0 missing=0] after[value=2.191937124999545 ok=36 unavailable=0 missing=0]"
        },
        {
          "name": "diagnostics.overhead.lightOverOff.txnCommitMs.p95DeltaRatio",
          "unit": "ratio",
          "scope": "points",
          "before": {
            "ok": 36,
            "unavailable": 0,
            "missing": 0,
            "value": 1.30933333333394
          },
          "after": {
            "ok": 36,
            "unavailable": 0,
            "missing": 0,
            "value": 1.4263128176175432
          },
          "message": "diagnostics.overhead.lightOverOff.txnCommitMs.p95DeltaRatio(points) unit=ratio: before[value=1.30933333333394 ok=36 unavailable=0 missing=0] after[value=1.4263128176175432 ok=36 unavailable=0 missing=0]"
        },
        {
          "name": "diagnostics.overhead.lightOverOff.txnCommitMs.p95Ratio",
          "unit": "ratio",
          "scope": "points",
          "before": {
            "ok": 36,
            "unavailable": 0,
            "missing": 0,
            "value": 2.30933333333394
          },
          "after": {
            "ok": 36,
            "unavailable": 0,
            "missing": 0,
            "value": 2.4263128176175432
          },
          "message": "diagnostics.overhead.lightOverOff.txnCommitMs.p95Ratio(points) unit=ratio: before[value=2.30933333333394 ok=36 unavailable=0 missing=0] after[value=2.4263128176175432 ok=36 unavailable=0 missing=0]"
        },
        {
          "name": "runtime.heapDeltaBytes.median",
          "unit": "bytes",
          "scope": "points",
          "before": {
            "ok": 36,
            "unavailable": 0,
            "missing": 0,
            "value": 50613344
          },
          "after": {
            "ok": 36,
            "unavailable": 0,
            "missing": 0,
            "value": 50242440
          },
          "message": "runtime.heapDeltaBytes.median(points) unit=bytes: before[value=50613344 ok=36 unavailable=0 missing=0] after[value=50242440 ok=36 unavailable=0 missing=0]"
        },
        {
          "name": "runtime.heapDeltaBytes.p95",
          "unit": "bytes",
          "scope": "points",
          "before": {
            "ok": 36,
            "unavailable": 0,
            "missing": 0,
            "value": 51641560
          },
          "after": {
            "ok": 36,
            "unavailable": 0,
            "missing": 0,
            "value": 51282184
          },
          "message": "runtime.heapDeltaBytes.p95(points) unit=bytes: before[value=51641560 ok=36 unavailable=0 missing=0] after[value=51282184 ok=36 unavailable=0 missing=0]"
        }
      ]
    }
  ]
}
