{
  "schemaVersion": 1,
  "meta": {
    "createdAt": "2025-12-31T10:21:42.013Z",
    "from": {
      "file": "specs/046-core-ng-roadmap/perf/before.node.default-kernel.core-ng.darwin-arm64.default.json",
      "commit": "b0a1166c002c2f8aad61f0158af2666e32ea678d"
    },
    "to": {
      "file": "specs/046-core-ng-roadmap/perf/after.node.default-kernel.core.darwin-arm64.default.json",
      "commit": "b0a1166c002c2f8aad61f0158af2666e32ea678d"
    },
    "comparability": {
      "comparable": true,
      "allowConfigDrift": false,
      "allowEnvDrift": false,
      "configMismatches": [],
      "envMismatches": [],
      "warnings": [
        "git.dirty.before=true",
        "git.dirty.after=true"
      ]
    }
  },
  "summary": {
    "regressions": 1,
    "improvements": 0,
    "budgetViolations": 0
  },
  "suites": [
    {
      "id": "converge.txnCommit",
      "thresholdDeltas": [
        {
          "budget": {
            "id": "auto<=full*1.05",
            "type": "relative",
            "metric": "runtime.txnCommitMs",
            "maxRatio": 1.05,
            "numeratorRef": "convergeMode=auto",
            "denominatorRef": "convergeMode=full"
          },
          "where": {
            "dirtyRootsRatio": 0.75
          },
          "beforeMaxLevel": 2000,
          "afterMaxLevel": null,
          "message": "[category=runtime] auto<=full*1.05 {dirtyRootsRatio=0.75}: before=2000 after=null (after:budgetExceeded)",
          "recommendations": [
            {
              "id": "014-boundary.converge.reduce-steps-or-dirty-roots",
              "title": "降低 steps/dirty-roots 规模或优化收敛策略",
              "detail": "事务收敛相关边界回归，可优先检查 steps/dirty-roots 配置，或回退到更保守的收敛策略。"
            }
          ]
        }
      ],
      "budgetViolations": [],
      "evidenceDeltas": [
        {
          "name": "diagnostics.overhead.fullOverOff.txnCommitMs.medianDeltaMs",
          "unit": "count",
          "scope": "points",
          "before": {
            "ok": 36,
            "unavailable": 0,
            "missing": 0,
            "value": 68.40037699999993
          },
          "after": {
            "ok": 36,
            "unavailable": 0,
            "missing": 0,
            "value": 65.1298769999973
          },
          "message": "diagnostics.overhead.fullOverOff.txnCommitMs.medianDeltaMs(points) unit=count: before[value=68.40037699999993 ok=36 unavailable=0 missing=0] after[value=65.1298769999973 ok=36 unavailable=0 missing=0]"
        },
        {
          "name": "diagnostics.overhead.fullOverOff.txnCommitMs.medianDeltaRatio",
          "unit": "ratio",
          "scope": "points",
          "before": {
            "ok": 36,
            "unavailable": 0,
            "missing": 0,
            "value": 1.1821976235143978
          },
          "after": {
            "ok": 36,
            "unavailable": 0,
            "missing": 0,
            "value": 1.1734325665331413
          },
          "message": "diagnostics.overhead.fullOverOff.txnCommitMs.medianDeltaRatio(points) unit=ratio: before[value=1.1821976235143978 ok=36 unavailable=0 missing=0] after[value=1.1734325665331413 ok=36 unavailable=0 missing=0]"
        },
        {
          "name": "diagnostics.overhead.fullOverOff.txnCommitMs.medianRatio",
          "unit": "ratio",
          "scope": "points",
          "before": {
            "ok": 36,
            "unavailable": 0,
            "missing": 0,
            "value": 2.182197623514398
          },
          "after": {
            "ok": 36,
            "unavailable": 0,
            "missing": 0,
            "value": 2.1734325665331413
          },
          "message": "diagnostics.overhead.fullOverOff.txnCommitMs.medianRatio(points) unit=ratio: before[value=2.182197623514398 ok=36 unavailable=0 missing=0] after[value=2.1734325665331413 ok=36 unavailable=0 missing=0]"
        },
        {
          "name": "diagnostics.overhead.fullOverOff.txnCommitMs.p95DeltaMs",
          "unit": "count",
          "scope": "points",
          "before": {
            "ok": 36,
            "unavailable": 0,
            "missing": 0,
            "value": 71.88812399999767
          },
          "after": {
            "ok": 36,
            "unavailable": 0,
            "missing": 0,
            "value": 68.08570999999927
          },
          "message": "diagnostics.overhead.fullOverOff.txnCommitMs.p95DeltaMs(points) unit=count: before[value=71.88812399999767 ok=36 unavailable=0 missing=0] after[value=68.08570999999927 ok=36 unavailable=0 missing=0]"
        },
        {
          "name": "diagnostics.overhead.fullOverOff.txnCommitMs.p95DeltaRatio",
          "unit": "ratio",
          "scope": "points",
          "before": {
            "ok": 36,
            "unavailable": 0,
            "missing": 0,
            "value": 1.0254730186408012
          },
          "after": {
            "ok": 36,
            "unavailable": 0,
            "missing": 0,
            "value": 1.1588576408321885
          },
          "message": "diagnostics.overhead.fullOverOff.txnCommitMs.p95DeltaRatio(points) unit=ratio: before[value=1.0254730186408012 ok=36 unavailable=0 missing=0] after[value=1.1588576408321885 ok=36 unavailable=0 missing=0]"
        },
        {
          "name": "diagnostics.overhead.fullOverOff.txnCommitMs.p95Ratio",
          "unit": "ratio",
          "scope": "points",
          "before": {
            "ok": 36,
            "unavailable": 0,
            "missing": 0,
            "value": 2.025473018640801
          },
          "after": {
            "ok": 36,
            "unavailable": 0,
            "missing": 0,
            "value": 2.1588576408321885
          },
          "message": "diagnostics.overhead.fullOverOff.txnCommitMs.p95Ratio(points) unit=ratio: before[value=2.025473018640801 ok=36 unavailable=0 missing=0] after[value=2.1588576408321885 ok=36 unavailable=0 missing=0]"
        },
        {
          "name": "diagnostics.overhead.lightOverOff.txnCommitMs.medianDeltaRatio",
          "unit": "ratio",
          "scope": "points",
          "before": {
            "ok": 36,
            "unavailable": 0,
            "missing": 0,
            "value": 1.2163339587247393
          },
          "after": {
            "ok": 36,
            "unavailable": 0,
            "missing": 0,
            "value": 1.21677056102991
          },
          "message": "diagnostics.overhead.lightOverOff.txnCommitMs.medianDeltaRatio(points) unit=ratio: before[value=1.2163339587247393 ok=36 unavailable=0 missing=0] after[value=1.21677056102991 ok=36 unavailable=0 missing=0]"
        },
        {
          "name": "diagnostics.overhead.lightOverOff.txnCommitMs.medianRatio",
          "unit": "ratio",
          "scope": "points",
          "before": {
            "ok": 36,
            "unavailable": 0,
            "missing": 0,
            "value": 2.2163339587247393
          },
          "after": {
            "ok": 36,
            "unavailable": 0,
            "missing": 0,
            "value": 2.21677056102991
          },
          "message": "diagnostics.overhead.lightOverOff.txnCommitMs.medianRatio(points) unit=ratio: before[value=2.2163339587247393 ok=36 unavailable=0 missing=0] after[value=2.21677056102991 ok=36 unavailable=0 missing=0]"
        },
        {
          "name": "diagnostics.overhead.lightOverOff.txnCommitMs.p95DeltaRatio",
          "unit": "ratio",
          "scope": "points",
          "before": {
            "ok": 36,
            "unavailable": 0,
            "missing": 0,
            "value": 1.2494397201289336
          },
          "after": {
            "ok": 36,
            "unavailable": 0,
            "missing": 0,
            "value": 1.1231516875728347
          },
          "message": "diagnostics.overhead.lightOverOff.txnCommitMs.p95DeltaRatio(points) unit=ratio: before[value=1.2494397201289336 ok=36 unavailable=0 missing=0] after[value=1.1231516875728347 ok=36 unavailable=0 missing=0]"
        },
        {
          "name": "diagnostics.overhead.lightOverOff.txnCommitMs.p95Ratio",
          "unit": "ratio",
          "scope": "points",
          "before": {
            "ok": 36,
            "unavailable": 0,
            "missing": 0,
            "value": 2.2494397201289336
          },
          "after": {
            "ok": 36,
            "unavailable": 0,
            "missing": 0,
            "value": 2.1231516875728347
          },
          "message": "diagnostics.overhead.lightOverOff.txnCommitMs.p95Ratio(points) unit=ratio: before[value=2.2494397201289336 ok=36 unavailable=0 missing=0] after[value=2.1231516875728347 ok=36 unavailable=0 missing=0]"
        },
        {
          "name": "runtime.heapDeltaBytes.median",
          "unit": "bytes",
          "scope": "points",
          "before": {
            "ok": 36,
            "unavailable": 0,
            "missing": 0,
            "value": 50267768
          },
          "after": {
            "ok": 36,
            "unavailable": 0,
            "missing": 0,
            "value": 50145048
          },
          "message": "runtime.heapDeltaBytes.median(points) unit=bytes: before[value=50267768 ok=36 unavailable=0 missing=0] after[value=50145048 ok=36 unavailable=0 missing=0]"
        },
        {
          "name": "runtime.heapDeltaBytes.p95",
          "unit": "bytes",
          "scope": "points",
          "before": {
            "ok": 36,
            "unavailable": 0,
            "missing": 0,
            "value": 51349528
          },
          "after": {
            "ok": 36,
            "unavailable": 0,
            "missing": 0,
            "value": 51201168
          },
          "message": "runtime.heapDeltaBytes.p95(points) unit=bytes: before[value=51349528 ok=36 unavailable=0 missing=0] after[value=51201168 ok=36 unavailable=0 missing=0]"
        }
      ],
      "notes": "mostSignificantRegression: auto<=full*1.05 {dirtyRootsRatio=0.75} (before=2000, after=null)"
    }
  ]
}
