{
  "schemaVersion": 1,
  "meta": {
    "createdAt": "2025-12-29T17:17:13.298Z",
    "from": {
      "file": "specs/057-core-ng-static-deps-without-proxy/perf/before.node.legacy.dynamic.darwin-arm64.default.worktree.gc.json"
    },
    "to": {
      "file": "specs/057-core-ng-static-deps-without-proxy/perf/after.node.selectorGraph.darwin-arm64.default.worktree.gc.json"
    },
    "comparability": {
      "comparable": true,
      "allowConfigDrift": false,
      "allowEnvDrift": false,
      "configMismatches": [],
      "envMismatches": [],
      "warnings": []
    }
  },
  "summary": {
    "regressions": 0,
    "improvements": 0,
    "budgetViolations": 0
  },
  "suites": [
    {
      "id": "converge.txnCommit",
      "budgetViolations": [],
      "evidenceDeltas": [
        {
          "name": "diagnostics.overhead.fullOverOff.txnCommitMs.medianDeltaMs",
          "unit": "count",
          "scope": "points",
          "before": {
            "ok": 36,
            "unavailable": 0,
            "missing": 0,
            "value": 58.991586000043526
          },
          "after": {
            "ok": 36,
            "unavailable": 0,
            "missing": 0,
            "value": 60.452671000003875
          },
          "message": "diagnostics.overhead.fullOverOff.txnCommitMs.medianDeltaMs(points) unit=count: before[value=58.991586000043526 ok=36 unavailable=0 missing=0] after[value=60.452671000003875 ok=36 unavailable=0 missing=0]"
        },
        {
          "name": "diagnostics.overhead.fullOverOff.txnCommitMs.medianDeltaRatio",
          "unit": "ratio",
          "scope": "points",
          "before": {
            "ok": 36,
            "unavailable": 0,
            "missing": 0,
            "value": 0.661298779333559
          },
          "after": {
            "ok": 36,
            "unavailable": 0,
            "missing": 0,
            "value": 0.6320467043259512
          },
          "message": "diagnostics.overhead.fullOverOff.txnCommitMs.medianDeltaRatio(points) unit=ratio: before[value=0.661298779333559 ok=36 unavailable=0 missing=0] after[value=0.6320467043259512 ok=36 unavailable=0 missing=0]"
        },
        {
          "name": "diagnostics.overhead.fullOverOff.txnCommitMs.medianRatio",
          "unit": "ratio",
          "scope": "points",
          "before": {
            "ok": 36,
            "unavailable": 0,
            "missing": 0,
            "value": 1.661298779333559
          },
          "after": {
            "ok": 36,
            "unavailable": 0,
            "missing": 0,
            "value": 1.6320467043259512
          },
          "message": "diagnostics.overhead.fullOverOff.txnCommitMs.medianRatio(points) unit=ratio: before[value=1.661298779333559 ok=36 unavailable=0 missing=0] after[value=1.6320467043259512 ok=36 unavailable=0 missing=0]"
        },
        {
          "name": "diagnostics.overhead.fullOverOff.txnCommitMs.p95DeltaMs",
          "unit": "count",
          "scope": "points",
          "before": {
            "ok": 36,
            "unavailable": 0,
            "missing": 0,
            "value": 62.548417999975754
          },
          "after": {
            "ok": 36,
            "unavailable": 0,
            "missing": 0,
            "value": 63.65078499997253
          },
          "message": "diagnostics.overhead.fullOverOff.txnCommitMs.p95DeltaMs(points) unit=count: before[value=62.548417999975754 ok=36 unavailable=0 missing=0] after[value=63.65078499997253 ok=36 unavailable=0 missing=0]"
        },
        {
          "name": "diagnostics.overhead.fullOverOff.txnCommitMs.p95DeltaRatio",
          "unit": "ratio",
          "scope": "points",
          "before": {
            "ok": 36,
            "unavailable": 0,
            "missing": 0,
            "value": 0.5795579417971743
          },
          "after": {
            "ok": 36,
            "unavailable": 0,
            "missing": 0,
            "value": 0.7084904303864554
          },
          "message": "diagnostics.overhead.fullOverOff.txnCommitMs.p95DeltaRatio(points) unit=ratio: before[value=0.5795579417971743 ok=36 unavailable=0 missing=0] after[value=0.7084904303864554 ok=36 unavailable=0 missing=0]"
        },
        {
          "name": "diagnostics.overhead.fullOverOff.txnCommitMs.p95Ratio",
          "unit": "ratio",
          "scope": "points",
          "before": {
            "ok": 36,
            "unavailable": 0,
            "missing": 0,
            "value": 1.5795579417971743
          },
          "after": {
            "ok": 36,
            "unavailable": 0,
            "missing": 0,
            "value": 1.7084904303864554
          },
          "message": "diagnostics.overhead.fullOverOff.txnCommitMs.p95Ratio(points) unit=ratio: before[value=1.5795579417971743 ok=36 unavailable=0 missing=0] after[value=1.7084904303864554 ok=36 unavailable=0 missing=0]"
        },
        {
          "name": "diagnostics.overhead.lightOverOff.txnCommitMs.medianDeltaRatio",
          "unit": "ratio",
          "scope": "points",
          "before": {
            "ok": 36,
            "unavailable": 0,
            "missing": 0,
            "value": 0.5728243757988676
          },
          "after": {
            "ok": 36,
            "unavailable": 0,
            "missing": 0,
            "value": 0.53887426604179
          },
          "message": "diagnostics.overhead.lightOverOff.txnCommitMs.medianDeltaRatio(points) unit=ratio: before[value=0.5728243757988676 ok=36 unavailable=0 missing=0] after[value=0.53887426604179 ok=36 unavailable=0 missing=0]"
        },
        {
          "name": "diagnostics.overhead.lightOverOff.txnCommitMs.medianRatio",
          "unit": "ratio",
          "scope": "points",
          "before": {
            "ok": 36,
            "unavailable": 0,
            "missing": 0,
            "value": 1.5728243757988676
          },
          "after": {
            "ok": 36,
            "unavailable": 0,
            "missing": 0,
            "value": 1.53887426604179
          },
          "message": "diagnostics.overhead.lightOverOff.txnCommitMs.medianRatio(points) unit=ratio: before[value=1.5728243757988676 ok=36 unavailable=0 missing=0] after[value=1.53887426604179 ok=36 unavailable=0 missing=0]"
        },
        {
          "name": "diagnostics.overhead.lightOverOff.txnCommitMs.p95DeltaRatio",
          "unit": "ratio",
          "scope": "points",
          "before": {
            "ok": 36,
            "unavailable": 0,
            "missing": 0,
            "value": 0.5215949960701536
          },
          "after": {
            "ok": 36,
            "unavailable": 0,
            "missing": 0,
            "value": 0.5437355863587505
          },
          "message": "diagnostics.overhead.lightOverOff.txnCommitMs.p95DeltaRatio(points) unit=ratio: before[value=0.5215949960701536 ok=36 unavailable=0 missing=0] after[value=0.5437355863587505 ok=36 unavailable=0 missing=0]"
        },
        {
          "name": "diagnostics.overhead.lightOverOff.txnCommitMs.p95Ratio",
          "unit": "ratio",
          "scope": "points",
          "before": {
            "ok": 36,
            "unavailable": 0,
            "missing": 0,
            "value": 1.5215949960701536
          },
          "after": {
            "ok": 36,
            "unavailable": 0,
            "missing": 0,
            "value": 1.5437355863587505
          },
          "message": "diagnostics.overhead.lightOverOff.txnCommitMs.p95Ratio(points) unit=ratio: before[value=1.5215949960701536 ok=36 unavailable=0 missing=0] after[value=1.5437355863587505 ok=36 unavailable=0 missing=0]"
        },
        {
          "name": "runtime.heapDeltaBytes.median",
          "unit": "bytes",
          "scope": "points",
          "before": {
            "ok": 36,
            "unavailable": 0,
            "missing": 0,
            "value": 380616
          },
          "after": {
            "ok": 36,
            "unavailable": 0,
            "missing": 0,
            "value": 525656
          },
          "message": "runtime.heapDeltaBytes.median(points) unit=bytes: before[value=380616 ok=36 unavailable=0 missing=0] after[value=525656 ok=36 unavailable=0 missing=0]"
        },
        {
          "name": "runtime.heapDeltaBytes.p95",
          "unit": "bytes",
          "scope": "points",
          "before": {
            "ok": 36,
            "unavailable": 0,
            "missing": 0,
            "value": 2751968
          },
          "after": {
            "ok": 36,
            "unavailable": 0,
            "missing": 0,
            "value": 2635736
          },
          "message": "runtime.heapDeltaBytes.p95(points) unit=bytes: before[value=2751968 ok=36 unavailable=0 missing=0] after[value=2635736 ok=36 unavailable=0 missing=0]"
        }
      ]
    }
  ]
}
